<?xml version="1.0" encoding="UTF-8"?>
<xs:schema xmlns:xs="http://www.w3.org/2001/XMLSchema">
    <xs:element name="bib">
        <xs:complexType>
            <xs:sequence>
                <xs:element name="libro" maxOccurs="unbounded">
                    <xs:complexType>
                        <xs:sequence>
                            <xs:element name="titulo" minOccurs="1" type="xs:string" />
                            <xs:element ref="autor" minOccurs="1" maxOccurs="unbounded" />
                            <xs:element name="editorial" minOccurs="1" type="xs:string" />
                            <xs:element name="precio" minOccurs="1" type="xs:decimal" />
                            <xs:element name="codigoPais" minOccurs="1" default="ESP">
                                <xs:simpleType>
                                    <xs:restriction base="xs:string">
                                        <xs:enumeration value="ESP" />
                                        <xs:enumeration value="ITA" />
                                        <xs:enumeration value="FRA" />
                                        <xs:enumeration value="ALE" />
                                    </xs:restriction>
                                </xs:simpleType>
                            </xs:element>
                        </xs:sequence>
                        <xs:attribute name="anyo">
                        </xs:attribute>
                    </xs:complexType>
                </xs:element>
            </xs:sequence>
            <xs:attribute name="nombre" type="xs:string" />
            <xs:attribute name="centro" type="xs:string" />
            <xs:attribute name="portada" type="xs:string" />
        </xs:complexType>
    </xs:element>

    <xs:element name="autor">
        <xs:complexType>
            <xs:sequence>
                <xs:element name="apellido" minOccurs="1">
                    <xs:simpleType>
                        <xs:restriction base="xs:string">
                            <xs:pattern value="[a-z]" />
                        </xs:restriction>
                    </xs:simpleType>
                </xs:element>
                <xs:element name="nombre" minOccurs="1" type="xs:string" />
                <xs:element name="cedula" minOccurs="1" type="xs:string" />
            </xs:sequence>
            <xs:attribute name="foto" type="xs:string" />
            <xs:attribute name="id" type="xs:string" />
        </xs:complexType>
    </xs:element>
    
    
    <xs:complexType name="infoautor">
        <xs:sequence>
            <xs:element name="ciudad" type="xs:string"/>
            <xs:element name="pais" type="xs:string"/>
            <xs:element name="telefono" type="xs:string"/>
            <xs:element name="correo" type="xs:string"/>
        </xs:sequence>
    </xs:complexType>
</xs:schema>


<complexType>

</complexType>




